Publication Year,Author,Title,Url,Date,Extra,Manual Tags
2025,"Sahu, A.; Nguyen, T.; Chen, K.; Zhang, X.; Hassanaly, M.",Detection of False Data Injection Attacks (FDIA) on Power Dynamical Systems with a State Prediction Method,https://www.scopus.com/inward/record.uri?eid=2-s2.0-85214300196&doi=10.1109%2FACCESS.2024.3524942&partnerID=40&md5=66a02dbaea4a116400572f1717d597aa,2025,15 citations (Semantic Scholar/DOI) [2025-11-26] Publisher: Institute of Electrical and Electronics Engineers Inc.,#done; graph neural networks; Graph neural networks; Power; Prediction models; False data injection attacks; Attack detection; Detection methods; False data injection; Prediction modelling; Short term memory; Frequency stability; State prediction; dynamic state prediction; long short term memory; Dynamic state predictions; #cybersecurity
2025,"Lu, L.; Zhai, G.; Wang, T.; Yu, X.; Li, B.; He, Y.; Deng, F.; Dong, W.",Multidomain Health Indicator Construction for Wind Turbine Gearboxes Situational Awareness Under Generation–Grid–Load–Storage Integration,https://www.scopus.com/inward/record.uri?eid=2-s2.0-105017099664&doi=10.1109%2FJSEN.2025.3607962&partnerID=40&md5=b79b04ed3fd1b407e6ad1ec58455153f,2025,Publisher: Institute of Electrical and Electronics Engineers Inc.,#done; Convolutional networks; Wind turbines; Spatio-temporal; Convolution; Electric power plant loads; Electric load dispatching; Failure analysis; Fault detection; Dynamics; Situational awareness; Temporal differences; Gears; Generation-grid-load-storage integration; Generation–grid–load–storage integration; Health indicators; Multi-domain health indicator; Multi-domains; multidomain health indicator (HI); situational awareness; Spatio-temporal difference graph convolutional network; spatiotemporal difference graph convolutional network (STDGCN); wind turbine gearbox; Wind turbine gearboxes; #faults-reliability
2025,"Dai, Z.; Song, X.; Hu, X.; Qin, C.; Zhang, W.; Xie, X.; Han, J.; Li, H.",Unit Commitment Warm-Start Decision Method Based on Similarity Computation via Graph Convolutional Networks,https://www.scopus.com/inward/record.uri?eid=2-s2.0-105010198675&doi=10.1109%2FSGAI64825.2025.11009427&partnerID=40&md5=675fd18ace038de4c6e5bd971d7b986c,2025,"Journal Abbreviation: Int. Conf. Smart Grid Artif. Intell., SGAI",#done; Convolutional networks; Graph convolutional network; Convolution; Graph theory; Learning systems; graph convolutional network; Data driven; Unit Commitment; Model-based OPC; data-driven; Warm start; Buses; unit commitment; Decision method; Decision theory; Graph similarity; graph similarity computation; Graph similarity computation; Similarity computation; #optimization-control
2025,"Kordowich, G.; Oelhaf, J.; Maier, A.; Bayer, S.; Jaeger, J.",A Graph Neural Network-Based Approach for Power System Protection,https://www.scopus.com/inward/record.uri?eid=2-s2.0-105019322844&doi=10.1109%2FPowerTech59965.2025.11180650&partnerID=40&md5=47b8712ef5ff306479a8021a9550cbec,2025,"Journal Abbreviation: IEEE Kiel PowerTech, PowerTech",#done; Power grids; Graph neural networks; Network-based; fault location; graph neural network; smart grid; Smart grid; Power system protection; Learning systems; machine learning; Machine-learning; Smart power grids; Electric power transmission networks; Fault detection; Electric power system protection; Faults detection; Network-based approach; fault detection; Electric fault location; Local measurement; Network process; Relay protection; #faults-reliability
2024,"Ye, R.; Shi, Z.; Song, Y.; Zhang, F.",Charging Load Forecasting of Highway Infrastructure Considering Spatiotemporal Coupling,https://www.scopus.com/inward/record.uri?eid=2-s2.0-105002219922&doi=10.1109%2FAPPEEC61255.2024.10922663&partnerID=40&md5=e4a4d0bea27e398a8b3e487ef35ece5e,2024,"Journal Abbreviation: Asia-Pacific Pow. Energy Eng. Conf., APPEEC",#done; Graph neural networks; Distribution characteristics; adaptive graph neural network; Adaptive graph neural network; Charging loads; Coupling systems; Energy couplings; gated cycle unit; Gated cycle unit; Load distribution characteristic; load distribution characteristics; Load distributions; traffic energy coupling system; Traffic energy coupling system; #forecasting
2025,"Prasad, U.; Mohanty, S.R.; Singh, S.P.; Jagan, A.",Robust Centralized Protection Scheme With AI-Based Fault Diagnosis Capabilities for Graph-Structured AC Microgrids,https://www.scopus.com/inward/record.uri?eid=2-s2.0-85212548660&doi=10.1109%2FTSG.2024.3515050&partnerID=40&md5=dc1f547e48fbbc6519b8aea1d90d7584,2025,Publisher: Institute of Electrical and Electronics Engineers Inc.,#done; graph neural networks; Graph neural networks; Network-based; Graph theory; Cyber security; fault diagnosis; Fault detection; Faults diagnosis; Microgrids; Graph embeddings; Digital storage; Microgrid; Protection schemes; power system protection; Computer graphics equipment; Faults diagnostics; AC microgrid; AC microgrids; Centralized protections; cyber security; Har; hardware-in-the-loop; Hardware-in-the-loop simulation; real-time systems; #faults-reliability
2025,"Prakash, S.; Dhivya, S.; Batumalay, M.",Power Quality Assessment in Grid-Connected Solar PV Systems Using Deep Learning Techniques,https://www.scopus.com/inward/record.uri?eid=2-s2.0-105004668432&doi=10.47738%2Fjads.v6i2.655&partnerID=40&md5=fbdbad0d7b41252d7b77d1645f94edc8,2025,Publisher: Bright Publisher,#done; Forecasting; Efficiency; Stability; Adaptability; Energy Efficiency; Grid Stability; Harmonic Distortions; Power Quality; Variability; Voltage Fluctuations; #faults-reliability
2025,"Miraki, A.; Parviainen, P.; Arghandeh, R.",Probabilistic forecasting of renewable energy and electricity demand using Graph-based Denoising Diffusion Probabilistic Model,https://www.scopus.com/inward/record.uri?eid=2-s2.0-85211708559&doi=10.1016%2Fj.egyai.2024.100459&partnerID=40&md5=2b0339245043bb784ba7476dab847abe,2025,Publisher: Elsevier B.V.,#done; Graph neural networks; Graph neural network; Forecasting; Multivariate time series; Demand response; Renewable energies; Energy demands; Electricity demands; Probabilistic forecasting; De-noising; Denoising diffusion probabilistic model; Denoising diffusion probabilistic models; Probabilistic models; Renewable electricity; #forecasting
2025,"Kumar, M.S.; Rai, S.; Kumar, R.R.",Identification of Oscillatory Modes from Degraded PMU Measurements Using an ML-Based GCN-GIN Scheme,https://www.scopus.com/inward/record.uri?eid=2-s2.0-105016880646&doi=10.1109%2FICEPE65965.2025.11139721&partnerID=40&md5=a1ceca4bb2306b84b6c8e5ebf5a91b9c,2025,"Journal Abbreviation: Int. Conf. Energy, Power Environ., ICEPE",#done; Convolutional networks; Networks/graphs; Phasor measurement units; Phasors; Anomaly detection; Network security; Electric power system stability; Intelligent systems; Phase measurement; Mode estimation; PMU; Electric fault currents; Networks and graphs; Bad data; Network scheme; Bad Data; Data communication equipment; GCN-GIN; Graph convolutional network-graph imputation network; Mode Estimation; Oscillatory mode; TLS-ESPRIT; #grid-analysis
2025,"Ma, A.; Ghamizi, S.; Cao, J.; Rodriguez Cortes, P.R.",SafePowerGraph-HIL: Real-Time HIL Validation of Heterogeneous GNNs for Bridging Sim-to-Real Gap in Power Grids,https://www.scopus.com/inward/record.uri?eid=2-s2.0-105019294056&doi=10.1109%2FPowerTech59965.2025.11180414&partnerID=40&md5=923c3f6272aa2bcff15862c4d13d0bc8,2025,"Journal Abbreviation: IEEE Kiel PowerTech, PowerTech",#done; Graph neural networks; Power; Learning systems; Electric power transmission networks; Heterogeneous graph; Electric power system control; State estimation; Simulation platform; Real time systems; Heterogeneous networks; Robustness (control systems); Adaptive control systems; Real-time simulation; Heterogeneous graph neural network; Fine tuning; Fine-tuning; Hardware in the loops; Hardware-in-the-Loop(HIL); Hardwarein-the-loop simulations (HIL); Heterogeneous Graph Neural Network(HGNN); Integration testing; Real-time hardware; Realtime simulation (RTS); Robust control; Sim-to-real gap; Sim-to-Real Gap; #methodology; #datasets
2025,"Tang, Q.; Sun, W.; Liu, Z.; Xiao, Y.; Yuan, X.; Zhao, C.",Collaborative Stability and Benefit Optimization of V2G Based on Multi-agent Graph Reinforcement Learning with Privacy Protection,https://www.scopus.com/inward/record.uri?eid=2-s2.0-105016766555&doi=10.1109%2FTTE.2025.3611807&partnerID=40&md5=5f48633e9287436dae10b3788eaf31ff,2025,Publisher: Institute of Electrical and Electronics Engineers Inc.,#done; Convolutional networks; Graph convolutional network; Graph Convolutional Networks; Reactive power; Reinforcement learnings; Convolution; Machine learning; Renewable energy; Optimisations; Power control; Electric vehicles; Multi agent systems; Multi agent; Renewable energy source; Distributed parameter control systems; Energy policy; Multi-objectives optimization; Multiobjective optimization; Multi-agent reinforcement learning; Distributed computer systems; Multi-objective optimization; Autonomous agents; Electric Vehicles; Active and Reactive Power Control; Active and reactive power controls; Electric machine control; EV; Federated Learning; Intelligent agents; Multi-agent Reinforcement Learning; Privacy protection; #optimization-control
2025,"Doostinia, M.; Zare, S.; Zahan, Z.G.; Falabretti, D.; Bolouki, S.; Verticale, G.",Graph Neural Network-Based Critical Node Classification in Cyber-Physical Power Systems,https://www.scopus.com/inward/record.uri?eid=2-s2.0-105019047612&doi=10.1109%2FEEEIC%2FICPSEurope64998.2025.11168990&partnerID=40&md5=ccaeecd8b262136f3cf1584438847cc8,2025,"Journal Abbreviation: Conf. Proc. - IEEE Int. Conf. Environ. Electr. Eng. IEEE Ind. Commer. Power Syst. Europe, EEEIC / I CPS Europe",#done; graph neural networks; Graph neural networks; Network-based; Smart grid; Learning systems; Smart power grids; Electric power transmission networks; Complex networks; Dynamics; Cyber Physical System; Cyber physicals; Classification (of information); Embedded systems; Cybe-physical power system; Physical power; Critical node; Electricity supply; complex networks; classification; cyber-physical power systems; Centrality metric; centrality metrics; Circuit theory; Interconnected structures; #cybersecurity
2025,"Zhai, H.; Deng, C.; Tian, B.; Liu, C.; Zhang, Y.; Zhou, B.; Zhu, Z.; Zhu, L.",Re-STGCN Based Short-Term Voltage Stability Assessment in Regional Power Systems,https://www.scopus.com/inward/record.uri?eid=2-s2.0-105015719814&doi=10.1109%2FCIEEC64805.2025.11116326&partnerID=40&md5=e8656dd9911f289a8be5b50db5524f40,2025,"Journal Abbreviation: IEEE Int. Electr. Energy Conf., CIEEC",#done; Convolution; Graph theory; Electric power system stability; Spatio-temporal graphs; Short-term voltage stability; Transient analysis; Power quality; Electric power system measurement; Voltage stability assessment; Transient stability; Transient voltage stability; Fault transients; Post-fault transient response data; Residual convolution; Short-term transient voltage stability; Spatiotemporal graph convolution; Transient response data; #faults-reliability
2025,"Basheer, L.; Ranjana, P.",A deep learning framework for intrusion detection system in smart grids using graph convolutional network,https://www.scopus.com/inward/record.uri?eid=2-s2.0-105001976195&doi=10.1088%2F2631-8695%2Fadb3f4&partnerID=40&md5=343de7f8b8f678e6d18778668e9b1576,2025,Publisher: Institute of Physics,#done; Convolutional networks; Auto encoders; Smart grid; Deep learning; anomaly detection; Anomaly detection; Intrusion Detection Systems; Network intrusion; Network security; Smart power grids; smart grids; Cyber security; deep learning; Learning frameworks; Intrusion detection; Intrusion-Detection; Steganography; Network coding; graphical convolutional network; Graphical convolutional network; cyber security; autoencoder; Digital communication systems; Ferroelectric RAM; intrusion detection; #cybersecurity
2025,"Liu, Z.; Deng, Y.; Bao, Y.; Chen, G.; Liu, T.; Wang, H.",Carbon Emission Prediction for Power Systems Based on Multimodal Big Data Fusion,https://www.scopus.com/inward/record.uri?eid=2-s2.0-105018797979&doi=10.1109%2FICPSET66018.2025.11159715&partnerID=40&md5=7bd5794a1f0eca3efecfa1af56df6ce6,2025,"Journal Abbreviation: Int. Conf. Power Syst. Energy Technol., ICPSET",#done; Power; Deep learning; Forecasting; Data mining; Power system; Learning systems; Deep neural networks; Electric power transmission networks; deep learning; Big data; Carbon; Power industry; Carbon emissions; power systems; Multi-modal; Modal analysis; Multi-modal fusion; multimodal fusion; Carbon emission prediction; Emissions prediction; Image fusion; Low emission; modal attention; Modal attention; #data-management
2025,"Fahim, S.R.; Atat, R.; Keçeci, C.; Takiddin, A.; Ismail, M.; Davis, K.R.; Serpedin, E.",Dynamic Spatio-Temporal Planning Strategy of EV Charging Stations and DGs Using GCNN-Based Predicted Power Demand,https://www.scopus.com/inward/record.uri?eid=2-s2.0-105001676572&doi=10.1109%2FTITS.2025.3541190&partnerID=40&md5=178c29cb2e73a248948aabd9f2dbd49f,2025,Publisher: Institute of Electrical and Electronics Engineers Inc.,#done; Convolutional neural network; Spatio-temporal; Reinforcement learnings; prediction; Reinforcement learning; Charging station; reinforcement learning; Distributed generators; Power demands; Multiobjective optimization; electric vehicles; Allocation strategy; Budget control; Charging station allocations; Charging stations allocation; dynamic program; Dynamic programs; Planning strategies; #optimization-control
2025,"Li, T.; Liu, C.; Liu, J.",Regional Photovoltaic Plant Power Prediction Based on Improved Spatio-temporal Graph Convolutional Network,https://www.scopus.com/inward/record.uri?eid=2-s2.0-105015440647&doi=10.1109%2FAAIEE64965.2025.11101678&partnerID=40&md5=c9699315224a40ce7bf4ffa1f5e4e648,2025,"Journal Abbreviation: IEEE Int. Symp. Appl. Artif. Intell. Electr. Eng., AAIEE",#done; Convolutional networks; Graph convolutional network; Power; Forecasting; Time series; Prediction models; Convolution; Power predictions; Electric power system interconnection; Statistical tests; Times series; Photovoltaics; Prediction modelling; Signal encoding; Improved time-series dense encoder; Photovoltaic power plant; Power Prediction; PV plants; Regional photovoltaic power plant; Regional photovoltaic power plants; #forecasting
2025,"Shuai, Y.; Tu, H.; Miao, W.; Xing, F.; Xia, Y.",Recovery Strategy for Power Grid based on Graph Learning Under Unconventional events,https://www.scopus.com/inward/record.uri?eid=2-s2.0-105018473399&doi=10.1109%2FIAEAC65194.2025.11166139&partnerID=40&md5=b3c8ccb4543b824e58119127d351df86,2025,Journal Abbreviation: Adv. Inf. Tech. Electron. and Autom. Control Conf.,#done; Power grids; Graph neural networks; Electric power transmission networks; Flow graphs; Graph learning; Learning frameworks; Benchmarking; Grid-based; Power Grid; Distributed computer systems; Extreme events; Computer system recovery; Recovery; Metalearning; Learning graphs; Collaborative learning; Enhanced recovery; Graph Learning; Learning samples; Recovery strategies; Recovery Strategy; Unconventional event; Unconventional events; #faults-reliability
2025,"Zheng, X.; Lee, A.; Huang, S.H.; Xie, L.",A Physics-Informed Graph Neural Network Framework for N-2 Contingency Screening: A Real-world Texas Grid Study,https://www.scopus.com/inward/record.uri?eid=2-s2.0-105020751903&doi=10.1109%2FOAJPE.2025.3626699&partnerID=40&md5=a71753001f21fb554fca194bca04fd25,2025,3 citations (Semantic Scholar/DOI) [2025-11-26] Publisher: Institute of Electrical and Electronics Engineers Inc.,#done; Graph neural networks; graph neural network; Electric load flow; Flow graphs; Network architecture; Electric power transmission; Computational efficiency; Contingency screening; Network frameworks; Graph classification; Real-world; Large-scale power systems; Flow based; AC power flow; contingency screening; Grid study; Power-flow solution; #faults-reliability
2025,"Tian, Z.; Lv, L.; Deng, W.",Multi-Expert Collaboration Based Information Graph Learning for Anomaly Diagnosis in Smart Grids,https://www.scopus.com/inward/record.uri?eid=2-s2.0-105020011024&doi=10.32604%2Fcmc.2025.069427&partnerID=40&md5=f4e2f5d60535f38089af72493af9ed1c,2025,Publisher: Tech Science Press,#done; Graph neural networks; Power distribution faults; Smart grid; Uncertainty; Failure analysis; Fault detection; Faults diagnosis; Uncertainty analysis; Computation theory; Statistics; Fault recognition; Power system fault; Electric fault currents; Power system fault diagnose; Power system fault diagnosis; information graph aggregation; Information graph aggregation; Multi-expert; multi-expert reliable decision; Multi-expert reliable decision; Reliability estimates; #faults-reliability
2025,"Liu, Z.; Zhang, Q.; Ju, C.; Xia, H.",Short-Term Power Forecasting for Wind Power Clusters Based on DWT-STG Integration,https://www.scopus.com/inward/record.uri?eid=2-s2.0-105013957921&doi=10.1109%2FCCDC65474.2025.11090453&partnerID=40&md5=f5b258cc9aa93c1bb0253f1217c55e2f,2025,"Journal Abbreviation: Proc. Chin. Control Decis. Conf., CCDC",#done; Convolutional networks; Power; Wind turbines; Wind forecasting; Convolution; Graph theory; Wind power; Weather forecasting; Electric utilities; Spatio-temporal graphs; Discrete-wavelet-transform; Signal reconstruction; Short-term forecasting; Discrete wavelet transforms; Wind power integration; Dynamic spatiotemporal graph; Dynamic Spatiotemporal Graph; Short-term forecasting of wind power cluster; Short-term Forecasting of Wind Power Clusters; Spatiotemporal graph convolutional; Spatiotemporal Graph Convolutional; Wave transform; Wave Transform; #forecasting
2025,"Wang, S.; Li, Z.; Lin, G.; Liang, Z.; Cai, Q.",Research on an Agent-Driven Knowledge Management System for Power Grid Infrastructure Projects,https://www.scopus.com/inward/record.uri?eid=2-s2.0-105017539512&doi=10.1109%2FICESEP66633.2025.11155280&partnerID=40&md5=b511b8dd5251d876feb68a2691eea17c,2025,"Journal Abbreviation: Int. Conf. Energy Syst. Electr. Power, ICESEP",#done; Power grids; Graph neural networks; graph neural network; Deep learning; Reinforcement learnings; Graph theory; Graphic methods; Electric power transmission networks; Complex networks; Decision making; Knowledge management; Multi agent systems; Grid projects; Project management; Electric power transmission; deep reinforcement learning; Knowledge graphs; knowledge graph; Knowledge graph; Transmissions; Grid infrastructures; Infrastructure project; Intelligent agents; Knowledge management system; multi-agent system; Multiagent systems (MASs); Transmission infrastructure; #data-management
2025,"Lu, G.; Bu, S.",Real-Time Contingency Screening for Converter-Dominated Power Systems: A Graphical-DeepONet Approach,https://www.scopus.com/inward/record.uri?eid=2-s2.0-105019785813&doi=10.1109%2FTII.2025.3614102&partnerID=40&md5=5af6b71b15e3a87910748f25021a3226,2025,Publisher: IEEE Computer Society,#done; Graph neural networks; Power; Graph neural network; graph neural network (GNN); Real- time; Trajectories; Transient analysis; Time domain analysis; Dynamics; Iterative methods; Real time systems; Computational efficiency; Power quality; Contingency screening; Transient stability; Power electronics; Operator networks; Power converters; Dynamic trajectories; Transient dynamics; Algebra; Converter-dominated power system; Converter-dominated power systems; Deep operator network; deep operator network (DeepONet); Real-time contingency screening; real-time contingency screening (CS); Trajectory prediction; Transient dynamic trajectory prediction; transient dynamics trajectories prediction; #faults-reliability
2025,"Zhou, Z.; Li, H.; Zheng, J.; Xiang, X.; Yao, R.; Tan, H.",Power System Frequency Response Prediction with Spatial-Temporal Graph Convolutional Networks,https://www.scopus.com/inward/record.uri?eid=2-s2.0-105013839537&doi=10.1109%2FIEECSC64206.2025.11100082&partnerID=40&md5=6880f2903e736a9074a33054a08a58fa,2025,"Journal Abbreviation: IEEE Int. Conf. Electr. Energy Convers. Syst. Control, IEECSC",#done; Convolutional networks; Forecasting; Convolution; Graph theory; Spatial temporals; Temporal graphs; Renewable energies; Wind power; Graph structures; Energy policy; Spatial-temporal graph convolutional network; Frequency response; Hybrid approach; Renewable Energy; Hybrid power; Frequency stability; Response prediction; Frequency response prediction; Frequency Response Prediction; Frequency Stability; Physic-data hybrid approach; Physics data; Physics-data hybrid approach; Spatial-Temporal Graph Convolutional Networks (STGCN); #faults-reliability
2020,"Fusco, F.; Eck, B.; Gormally, R.; Purcell, M.; Tirupathi, S.",Knowledge- And Data-driven Services for Energy Systems using Graph Neural Networks,https://www.scopus.com/inward/record.uri?eid=2-s2.0-85103847224&doi=10.1109%2FBigData50022.2020.9377845&partnerID=40&md5=459502c57d228ebd134b790964ce4035,2020,"Journal Abbreviation: Proc. - IEEE Int. Conf. Big Data, Big Data",#done; Graph neural networks; Smart grid; Electric load flow; Topology; Smart power grids; Electric power transmission networks; Data driven; Electric utilities; Decision making; Energy resources; Artificial intelligence; Distributed Energy Resources; Internet of things; Energy systems; Internet of Things; Electricity distribution systems; Renewable energy generators; Carbon-based; Energy source; Sensing devices; #data-management
2025,"Zhou, X.; Shi, J.; Cheng, Q.; Cheng, S.",A GraphSAGE Model for Spectral Feature Analysis of Wideband Oscillations,https://www.scopus.com/inward/record.uri?eid=2-s2.0-105019316644&doi=10.1109%2FPowerTech59965.2025.11180495&partnerID=40&md5=7652f6657dd59d1bfa5fea6e2a147caa,2025,"1 citations (Semantic Scholar/DOI) [2025-11-26] Journal Abbreviation: IEEE Kiel PowerTech, PowerTech",#done; Signal processing; Graph neural networks; Power; Graph neural network; Graphic methods; Computational efficiency; Wavelet transforms; Wide-band; Grid stability; Broad frequency range; Feature analysis; GraphSAGE model; Spectral analysis; Spectral analyze; Spectral feature; Spectrum analysis; Wideband oscillation; Wideband oscillations; #grid-analysis
2025,"Godhade, S.; Singh, P.; Kumar, J.",Design of an improved model for real-time fault detection and localization using hybrid transformer-CNN and graph neural networks,https://www.scopus.com/inward/record.uri?eid=2-s2.0-105016681139&doi=10.1109%2FMAC64480.2025.11139887&partnerID=40&md5=02ea33f6baaa2172bd693c7c93766b3e,2025,"Journal Abbreviation: Int. Conf. Microw., Antenna Commun., MAC",#done; Signal processing; Graph neural networks; Fault localization; Convolutional neural network; Deep learning; Learning systems; Machine-learning; Neural networks; Electric power transmission networks; Signal-processing; Fault detection; Electric lines; Electric power transmission; Transmission Line; Transmission-line; Artificial Intelligence; Machine Learning; Faults detection; Fault classification; Fault Classification; Fault management; Real time fault detection; Signal Processing; #faults-reliability
2025,"Nguyen, Q.V.; Delgado Fernandez, J.; Potenciano Menci, S.P.",Spatiotemporal Graph Neural Networks for Short-Term Load Forecasting: Does a graph inferred from smart meter data help?,https://www.scopus.com/inward/record.uri?eid=2-s2.0-105019304660&doi=10.1109%2FPowerTech59965.2025.11180479&partnerID=40&md5=410feb60e805a7beddd36e9efc512934,2025,"Journal Abbreviation: IEEE Kiel PowerTech, PowerTech",#done; Graph neural networks; graph neural network; Power; Electric power plant loads; Graphic methods; Short term load forecasting; Renewable energy; Smart meters; Graph structures; Spatio-temporal graphs; Historical data; Energy utilization; Electric load forecasting; Load forecasting model; Benchmarking; Housing; Spatio-temporal dependencies; Undirected graphs; Aggregates; Short-term Load Forecasting; spatiotemporal forecasting; Spatio-temporal forecasting; Benchmark; Future consumption; #forecasting
2025,"Wang, Y.; Liu, H.; Wu, X.; Liu, J.; Pan, L.; Meng, F.; Shahidehpour, M.",Resilience-Constrained Economic Dispatch With Graph Convolutional Network,https://www.scopus.com/inward/record.uri?eid=2-s2.0-105012734056&doi=10.1109%2FTPWRS.2025.3560178&partnerID=40&md5=8ba0e9d843eea70deb3f3dcad10e96f7,2025,Publisher: Institute of Electrical and Electronics Engineers Inc.,#done; Sampling; Convolutional networks; Graph convolutional network; Power; Convolution; Outages; graph convolutional network; Electric load dispatching; 'current; Mapping; Mapping relationships; Constrained optimization; System resiliences; Power system resilience; Electric power system economics; Economic Dispatch; Resilience index; resilience-constrained economic dispatch; Resilience-constrained economic dispatch; #optimization-control
2025,"Jin, Q.; Qin, S.; Lu, B.; Mo, Z.",Satellite and UAV-Assisted Transmission Line Fault Prediction Based on GNN,https://www.scopus.com/inward/record.uri?eid=2-s2.0-105015636532&doi=10.1109%2FCIEEC64805.2025.11116494&partnerID=40&md5=476b2db4745262e5447797e9934178cd,2025,"Journal Abbreviation: IEEE Int. Electr. Energy Conf., CIEEC",#done; Graph neural networks; Smart power grids; Electric power transmission networks; Prediction-based; Electric lines; Electric power transmission; Transmission-line; Source data; GNN; Multi-Sources; Fault prediction; Orbits; Antennas; Condition monitoring; Transmission line faults; Aerial vehicle; Communication satellites; Multi-source data fusion; Multi-Source Data Fusion; Satellite communication systems; Satellite-ground collaboration; Satellite-Ground Collaboration; Transmission Line Faults; Unmanned aerial vehicles (UAV); Vehicle transmissions; #faults-reliability
