Publication Year,Author,Title,Url,Date,Extra,Manual Tags
2023,"Chanda, D.; Soltani, N.Y.; ELMAN",Graph-Based Multi-Task Learning For Fault Detection In Smart Grid,https://www.scopus.com/inward/record.uri?eid=2-s2.0-85177217104&doi=10.1109%2fMLSP55844.2023.10285865&partnerID=40&md5=f68c2006008fc1b6c010c5bb6385d1f9,2023-09,"2 citations (Semantic Scholar/DOI) [2025-04-09] 5 citations (Crossref/DOI) [2025-04-07] 5 citations (Crossref) [2025-04-02] Journal Abbreviation: IEEE Int. Workshop Mach. Learn. Signal Process., MLSP",#done; graph neural networks; Graph neural networks; Smart grid; Graph-based; Cascading failures; Electric power distribution; Graphic methods; Learning systems; notion; Smart power grids; Multitask learning; Fault detection; Learning architectures; Faults detection; multi-task learning; Electrical faults; fault classification; Fault classification; Power grid operators; #faults-reliability
2022,"Calzada, D.; Hossain-Mckenzie, S.; Mao, Z.",Deep Learning Architecture for Processing Cyber-Physical Data in the Electric Grid,https://www.scopus.com/inward/record.uri?eid=2-s2.0-85128614142&doi=10.1109%2fPECI54197.2022.9744015&partnerID=40&md5=085bec59933798e62a9feb57f510f17a,2022,"4 citations (Semantic Scholar/DOI) [2025-04-09] 3 citations (Crossref/DOI) [2025-04-07] 3 citations (Crossref) [2025-04-02] Journal Abbreviation: IEEE Power Energy Conf. Illinois, PECI",#done; Graph neural networks; Deep learning; machine learning; notion; Cyber security; cybersecurity; Cybersecurity; Electric power transmission networks; Physical data; Cyber Physical System; Cyber physicals; Electric power system protection; Energy systems; Cybe-physical data; cyber-physical data; energy system; network; Network; rationale graph neural network; Rationale graph neural network; special protection scheme; Special protection schemes; Transformer modeling; transformer models; #data-management
2022,"Boyaci, O.; Umunnakwe, A.; Sahu, A.; Narimani, M.R.; Ismail, M.; Davis, K.R.; Serpedin, E.",Graph Neural Networks Based Detection of Stealth False Data Injection Attacks in Smart Grids,https://www.scopus.com/inward/record.uri?eid=2-s2.0-85118055312&doi=10.1109%2fJSYST.2021.3109082&partnerID=40&md5=079997f48a91da1431375f43842044b0,2022,88 citations (Semantic Scholar/DOI) [2025-04-09] 84 citations (Crossref/DOI) [2025-04-07] 84 citations (Crossref) [2025-04-02] Publisher: Institute of Electrical and Electronics Engineers Inc.,#done; Graph neural networks; Power; Graph neural network; smart grid; Smart grid; Network security; Power system; Topology; False data injection attacks; Smart power grids; Machine learning; graph neural networks (GNNs); machine learning (ML); Power measurement; Electric power transmission networks; Power systems security; Covariance matrices; Covariance matrix; False data injection attack; False data injection attacks (FDIAs); power system security; #cybersecurity
2024,"Behdadnia, T.; Thoelen, K.; Zobiri, F.; Deconinck, G.",Spatial-Temporal Graph Neural Network for Detecting and Localizing Anomalies in PMU Networks,https://www.scopus.com/inward/record.uri?eid=2-s2.0-85189635217&doi=10.1007%2f978-3-031-56776-6_7&partnerID=40&md5=49ea26305d53832b3b77e1e7792ac04b,2024,Journal Abbreviation: Commun. Comput. Info. Sci. Pages: 82 Publication Title: Commun. Comput. Info. Sci. DOI: 10.1007/978-3-031-56776-6_7,#done; Graph neural networks; Power; Graph neural network; Phasor measurement units; Anomaly detection; Cyber attacks; Long short-term memory; Network security; Graphic methods; Spatial temporals; Temporal graphs; Computer crime; Cyber security; Brain; Real- time; State estimation; Real time systems; Cyber Physical System; Anomaly Detection; Graph Neural Network (GNN); Chemical detection; Cyber-Security; False data injection; False Data Injection; Long Short-Term Memory (LSTM); #faults-reliability
2024,"Aironi, C.; Cornell, S.; Squartini, S.",A Graph-Based Neural Approach to Linear Sum Assignment Problems,https://www.scopus.com/inward/record.uri?eid=2-s2.0-85182770794&doi=10.1142%2fS0129065724500114&partnerID=40&md5=b5418e5734e0b82bf8d02a00fabf547c,2024,2 citations (Semantic Scholar/DOI) [2025-04-09] 1 citations (Crossref/DOI) [2025-04-07] 1 citations (Crossref/DOI) [2025-04-07] 1 citations (Crossref) [2025-04-02] Publisher: World Scientific,"#done; graph neural networks; Graph neural networks; Smart grid; Graph-based; Heuristic algorithms; Electric power distribution; Graphic methods; notion; Smart power grids; Deep neural networks; Smart meters; artificial neural network; learning; algorithm; Integer programming; Message passing; Algorithms; Assignment problems; Combinatorial optimization; Combinatorial optimization problems; computer simulation; Computer Simulation; deep neural networks; Grid optimization; Heuristic methods; Learning; Linear assignment problem; Linear networks; Linear sum assignment; Neural Networks, Computer; Optimal systems; reproducibility; Reproducibility of Results; smart grid optimization; Smart grid optimization; Smart meter scheduling; smart meters scheduling; #methodology"
2024,"Zou, Gang; Xia, Min; Zhang, Liudong; Lei, Zhen; Peng, Zhiqiang; Liu, Jun",UMGAN: multi-scale graph attention network for grid parameter identification,https://doi.org/10.1007/s00202-024-02589-0,7/11/24,0 citations (Semantic Scholar/DOI) [2025-04-09] 0 citations (Crossref/DOI) [2025-04-07] 0 citations (Crossref) [2025-04-02],#done; Power grids; Graph neural networks; Deep learning; Attention mechanism; Attention mechanisms; Convolution; Learning systems; Electric power transmission networks; Crime; Electric power transmission; Parameter estimation; Parameters identification; Multi-scales; Learning methods; Data corruption; Multi-scale graph convolution; Parameter identification; Shaped structures; U-shaped; U-shaped structure; #grid-analysis
2024,"Zhao, Weicheng; Lin, Xiaoyong; Xu, Jiwei",Multivariate Time Series Forecasting of Integrated Energy Systems Based on Fast Fourier Transform Fully Connected Space-Time Graph,,2024,0 citations (Crossref/DOI) [2025-04-07],#done; Graph neural networks; Fast Fourier Transform; Times series; Energy; Time step; Integrated energy systems; Patch; Space-Time Graph Neural Network; Spacetime; Resource allocation; Fast fourier; Fast Fourier transforms; Semantics Information; Space-time graph neural network; #forecasting
2022,"Zhao, Tianqiao; Yue, Meng; Wang, Jianhui",Structure-Informed Graph Learning of Networked Dependencies for Online Prediction of Power System Transient Dynamics,https://ieeexplore.ieee.org/document/9720101/,2022-11,27 citations (Semantic Scholar/DOI) [2025-04-09] 30 citations (Crossref/DOI) [2025-04-07] 29 citations (Crossref) [2025-04-02],#done; graph neural networks; Graph neural networks; Phasor measurement units; Deep learning; Forecasting; Spatial temporals; machine learning; Machine-learning; notion; System stability; Electric power transmission networks; Numerical methods; Online systems; Trajectories; Transient analysis; Message passing; Online prediction; transient stability; Dynamics reproduction; spatial-temporal dependencies; Dynamic Power; Transient dynamics; Prediction performance; System theory; Dynamic reproduction; Power system transients; Spatial-temporal dependency; #faults-reliability
2024,"Zhang, Yadong; Karve, Pranav M.; Mahadevan, Sankaran",Graph neural networks for power grid operational risk assessment under evolving grid topology,http://arxiv.org/abs/2405.07343,5/12/24,"0 citations (Semantic Scholar/arXiv) [2025-04-09] arXiv:2405.07343 [cs, eess, stat]",#done; #faults-reliability
2024,"Zhang, Yadong; Karve, Pranav M.; Mahadevan, Sankaran",Operational risk quantification of power grids using graph neural network surrogates of the DC OPF,http://arxiv.org/abs/2311.03661,4/21/24,"0 citations (Semantic Scholar/arXiv) [2025-04-09] arXiv:2311.03661 [cs, eess]",#done; #faults-reliability
2022,"Zhang, Qingyong; Chen, Jiahua; Xiao, Gang; He, Shangyang; Deng, Kunxiang",Transformgraph: A Novel Short-Term Electricity Net Load Forecasting Model,https://papers.ssrn.com/abstract=4192411,8/17/22,31 citations (Semantic Scholar/DOI) [2025-04-09] 0 citations (Crossref/DOI) [2025-04-07] 0 citations (Crossref) [2025-04-02],#done; #forecasting
2024,"Zhang, Jie; Zhu, Yihua; Liang, Zhuohang; Ma, Qinfeng; Zhang, Qingqing; Liu, Mingshun; An, Su; Pu, Qingxin; Dai, Jiang",Emergency control methods for power systems based on improved deep reinforcement learning,https://dx.doi.org/10.1088/1742-6596/2858/1/012035,2024-10,0 citations (Semantic Scholar/DOI) [2025-04-09] 0 citations (Crossref/DOI) [2025-04-07] 0 citations (Crossref) [2025-04-02] Publisher: IOP Publishing,#done; #faults-reliability
2022,"Yu, Yin; Jiang, Xinyuan; Huang, Daning; Li, Yan",PIDGeuN: Graph Neural Network-Enabled Transient Dynamics Prediction of Networked Microgrids Through Full-Field Measurement,http://arxiv.org/abs/2204.08557,4/18/22,"5 citations (Semantic Scholar/arXiv) [2025-04-09] arXiv:2204.08557 [cs, eess]",#done; notion; #faults-reliability
2024,"Yu, Yin; Harlim, John; Huang, Daning; Li, Yan",Learning Coarse-Grained Dynamics on Graph,https://papers.ssrn.com/abstract=4878937,6/27/24,0 citations (Crossref/DOI) [2025-04-07] 0 citations (Crossref) [2025-04-02],#done; #methodology
2024,"Yanmei, Jiang; Mingsheng, Liu; Yangyang, Li; Yaping, Liu; Jingyun, Zhang; Yifeng, Liu; Chunyang, Liu",Enhanced neighborhood node graph neural networks for load forecasting in smart grid,https://doi.org/10.1007/s13042-023-01796-8,1/1/24,16 citations (Semantic Scholar/DOI) [2025-04-09] 7 citations (Crossref/DOI) [2025-04-07] 7 citations (Crossref) [2025-04-02],#done; Graph neural networks; Graph neural network; Smart grid; Deep learning; Forecasting; Attention mechanisms; Graphic methods; notion; Smart power grids; Power predictions; Bi-directional; Electric loads; Metadata; Power quality; Box-Cox transformation; Lifelong learning; Load power prediction; Multi-attention mechanism; Dynamic loads; Box Cox transformation; Life long learning; Load power; #forecasting
2022,"Yang, Yuyun; Tan, Zhenfei; Yang, Haitao; Ruan, Guangchun; Zhong, Haiwang; Liu, Fengkui",Short-term electricity price forecasting based on graph convolution network and attention mechanism,https://onlinelibrary.wiley.com/doi/abs/10.1049/rpg2.12413,2022,17 citations (Semantic Scholar/DOI) [2025-11-26] 14 citations (Semantic Scholar/DOI) [2025-04-09] 14 citations (Crossref/DOI) [2025-04-07] 14 citations (Crossref) [2025-04-02] _eprint: https://onlinelibrary.wiley.com/doi/pdf/10.1049/rpg2.12413,#done; #forecasting
2024,"Yang, Mei; Qiu, Gao; Liu, Tingjian; Liu, Junyong; Liu, Kai; Li, Yaping",Probabilistic power flow based on physics-guided graph neural networks,https://linkinghub.elsevier.com/retrieve/pii/S0378779624007508,2024-10,1 citations (Semantic Scholar/DOI) [2025-04-09] 0 citations (Crossref/DOI) [2025-04-07] 0 citations (Crossref) [2025-04-02],#done; Graph neural networks; Graph neural network; Electric load flow; Stochastic systems; Numerical methods; Flow graphs; Real- time; Monte Carlo methods; Physic-guided learning; Physics-guided learning; Probabilistic power flow; Flow based; High nonlinear; High-dimensional; Higher-dimensional; Real-time probabilistic power flow; Stochastics; #optimization-control
2022,"Yang, Mei; Liu, Junyong; Qiu, Gao; Liu, Tingjian; Tang, Zhiyuan",AC Optimal Power Flows: Combining Lagrangian Dual and physics-Guided Graph Neutral Networks,https://www.techrxiv.org/doi/full/10.36227/techrxiv.21554775.v1,11/21/22,1 citations (Crossref/DOI) [2025-04-07] 1 citations (Crossref) [2025-04-02],#done; #optimization-control
2022,"Xia, Min; Wang, Zhiwei; Lu, Min; Pan, Lingling",MFAGCN: A new framework for identifying power grid branch parameters,https://www.sciencedirect.com/science/article/pii/S0378779622000852,6/1/22,21 citations (Semantic Scholar/DOI) [2025-04-09] 23 citations (Crossref/DOI) [2025-04-07] 23 citations (Crossref) [2025-04-02],#done; Power grids; Graph neural networks; Graph neural network; Deep learning; Convolution; Electric power transmission networks; Multilevels; Electric power transmission; Parameter estimation; Parameters identification; Multi-scales; Learning methods; Parameter identification; Gated attention network; Multi-level information; Small targets; #grid-analysis
2024,"Wu, Xuan",Research on Intelligent Grid Fault Prediction Communication System Based on Computer Big Data,https://ieeexplore.ieee.org/document/10594548/,5/24/24,0 citations (Semantic Scholar/DOI) [2025-11-26] 0 citations (Semantic Scholar/DOI) [2025-04-09] 0 citations (Crossref/DOI) [2025-04-07] 0 citations (Crossref) [2025-04-02],#done; Power grids; Graph neural networks; Deep learning; Forecasting; Smart power grids; Grid fault; Backpropagation; Fault detection; Big data; Deep Learning; GNN; Communications systems; Object recognition; Fault prediction; Network attack; Network attack identification; Object classification; Object Classification; Object Recognition; Objects recognition; #data-management
2021,"Wu, Tong; Zhang, Ying-Jun Angela; Liu, Yang; Lau, Wing Cheong; Xu, Huanle",Missing Data Recovery in Large Power Systems Using Network Embedding,https://ieeexplore.ieee.org/document/9161003/,2021-01,13 citations (Semantic Scholar/DOI) [2025-04-09] 12 citations (Crossref/DOI) [2025-04-07] 12 citations (Crossref) [2025-04-02],#done; notion; #data-management
2022,"Wu, Jiaxin; Wang, Pingfeng",Graph Learning based Generative Design for Resilience of Interdependent Network Systems,http://arxiv.org/abs/2207.00931,7/2/22,6 citations (Semantic Scholar/arXiv) [2025-04-09] arXiv:2207.00931 [cs],#done; #faults-reliability
2023,"Wu, Di; Lin, Weixuan",Efficient Residential Electric Load Forecasting via Transfer Learning and Graph Neural Networks,https://ieeexplore.ieee.org/document/9897067/,2023-05,43 citations (Semantic Scholar/DOI) [2025-04-09] 53 citations (Crossref/DOI) [2025-04-07] 53 citations (Crossref) [2025-04-02],#done; notion; #forecasting
2024,"Wei, Jie; He, Xing",Non-invasive load identification method in smart grid based on graph convolutional neural network,https://iopscience.iop.org/article/10.1088/1742-6596/2896/1/012034,11/1/24,0 citations (Semantic Scholar/DOI) [2025-04-09] 0 citations (Crossref/DOI) [2025-04-07],#done; #optimization-control
2024,"Wang, Shengyou; Li, Yuan; Shao, Chunfu; Wang, Pinxi; Wang, Aixi; Zhuge, Chengxiang",An Adaptive Spatio-Temporal Graph Recurrent Network for Short-Term Electric Vehicle Charging Demand Prediction,https://papers.ssrn.com/abstract=4750430,3/6/24,0 citations (Crossref/DOI) [2025-04-07] 0 citations (Crossref) [2025-04-02],#done; #forecasting
2024,"Wang, Qingwen; Yu, Tenglong; Chu, Hongliang; Xiong, Xiaozhou; Huang, Kang; Qiu, Rixuan; Hu, Bing; Yan, Haoran; Wang, Fan; Bai, Yang; Wang, Song; Qi, Jun; Liu, Siyan; Shi, Danni",Research on Graph Multi-Attention Neural Network for Power System Transient Stability Assessment,https://iopscience.iop.org/article/10.1088/1742-6596/2868/1/012012,10/1/24,1 citations (Semantic Scholar/DOI) [2025-11-26] 0 citations (Semantic Scholar/DOI) [2025-04-09] 0 citations (Crossref/DOI) [2025-04-07] 0 citations (Crossref) [2025-04-02],#done; #faults-reliability
2024,"Wang, Heng; Wang, Xiaoru; Liu, Liu; Sun, Xieli; Tian, Fang",A Data-Driven Method for Probabilistic Prediction of Power Grid Critical Section Power from Probability Distributions of Renewable Energy,https://papers.ssrn.com/abstract=4788370,4/9/24,0 citations (Crossref/DOI) [2025-04-07] 0 citations (Crossref/DOI) [2025-04-07] 0 citations (Crossref) [2025-04-02],#done; #forecasting
2024,"Varbella, Anna; Gjorgiev, Blazhe; Sartore, Federico; Zio, Enrico; Sansavini, Giovanni",Goal-Oriented Graph Generation for Transmission Expansion Planning,https://papers.ssrn.com/abstract=5008897,11/4/24,0 citations (Crossref/DOI) [2025-04-07],#done; #optimization-control
2024,"Varbella, Anna; Amara, Kenza; Gjorgiev, Blazhe; El-Assady, Mennatallah; Sansavini, Giovanni",PowerGraph: A power grid benchmark dataset for graph neural networks,http://arxiv.org/abs/2402.02827,6/3/24,"4 citations (Semantic Scholar/arXiv) [2025-04-09] arXiv:2402.02827 [cs, eess]",#done; #datasets
2023,"van der Sar, Erica; Zocca, Alessandro; Bhulai, Sandjai",Multi-Agent Reinforcement Learning for Power Grid Topology Optimization,http://arxiv.org/abs/2310.02605,10/4/23,"0 citations (Semantic Scholar/arXiv) [2025-04-09] arXiv:2310.02605 [cs, eess, stat]",#done; #optimization-control
2024,"Tuo, Mingjian; Zhao, Cunzhi; Zhang, Mulan; Gao, Tao; Shang, Xuequan",Gnn Assisted Frequency Constrained Unit Commitment of Multi-Region Power Systems with High Penetration of Renewable Energy Sources,https://papers.ssrn.com/abstract=5054822,12/13/24,0 citations (Crossref/DOI) [2025-04-07],#done; #optimization-control
2023,"Hou, R.; Zhang, Y.; Ou, Q.; Li, S.; He, Y.; Wang, H.; Zhou, Z.",Recommendation Method of Power Knowledge Retrieval Based on Graph Neural Network,https://www.scopus.com/inward/record.uri?eid=2-s2.0-85172938598&doi=10.3390%2felectronics12183922&partnerID=40&md5=3f813e7912369ad3157fc5b5d344b02c,2023,3 citations (Semantic Scholar/DOI) [2025-11-26] 1 citations (Semantic Scholar/DOI) [2025-04-09] 1 citations (Crossref/DOI) [2025-04-07] 1 citations (Crossref) [2025-04-02] Publisher: Multidisciplinary Digital Publishing Institute (MDPI),#done; graph neural network; notion; knowledge inference; recommender system; search intent prediction; #data-management
2022,"He, Y.; Chai, S.; Zhao, J.; Sun, Y.; Zhang, X.",A robust spatio-temporal prediction approach for wind power generation based on spectral temporal graph neural network,https://www.scopus.com/inward/record.uri?eid=2-s2.0-85133408596&doi=10.1049%2frpg2.12449&partnerID=40&md5=fd1beebdb2a28197c11dd3961c32190b,2022,9 citations (Semantic Scholar/DOI) [2025-11-26] 7 citations (Semantic Scholar/DOI) [2025-04-09] 7 citations (Crossref/DOI) [2025-04-07] 7 citations (Crossref) [2025-04-02] _eprint: https://onlinelibrary.wiley.com/doi/pdf/10.1049/rpg2.12449,#done; Graph neural networks; Power; Deep learning; Wind power generation; Temporal graphs; Wind power forecasting; Wind power; Weather forecasting; 'current; Spatio-temporal prediction; Electric power generation; Spatial correlations; Temporal correlations; Discrete Fourier transforms; Time domain; #forecasting
2024,"Hao, J.; Zhang, Z.; Ping, Y.",Power System Fault Diagnosis and Prediction System Based on Graph Neural Network,https://www.scopus.com/inward/record.uri?eid=2-s2.0-85183450004&doi=10.4018%2fIJITSA.336475&partnerID=40&md5=ee6d3c6af5dc59b0721c6d6a8dbf6850,2024,2 citations (Semantic Scholar/DOI) [2025-04-09] 2 citations (Crossref/DOI) [2025-04-07] 2 citations (Crossref) [2025-04-02] Publisher: IGI Global,#done; Graph neural networks; graph neural network; Power; Forecasting; prediction; Power system; Convolution; notion; fault diagnosis; power system; Failure analysis; Fault detection; Faults diagnosis; Operations and maintenance; Power system fault; Stability and reliabilities; Fault prediction; Fault-diagnosis system; Prediction systems; #faults-reliability
2023,"Haghshenas, S.H.; Hasnat, M.A.; Naeini, M.",A Temporal Graph Neural Network for Cyber Attack Detection and Localization in Smart Grids,https://www.scopus.com/inward/record.uri?eid=2-s2.0-85151507895&doi=10.1109%2fISGT51731.2023.10066446&partnerID=40&md5=4d0b681446c6236ae74126df25286024,2023,"38 citations (Semantic Scholar/DOI) [2025-11-26] 28 citations (Semantic Scholar/DOI) [2025-04-09] 21 citations (Crossref/DOI) [2025-04-07] 21 citations (Crossref) [2025-04-02] Journal Abbreviation: IEEE Power Energy Soc. Innov. Smart Grid Technol. Conf., ISGT",#done; Graph neural networks; Smart grid; Network security; Temporal graphs; Cyber-attacks; notion; Smart power grids; Detection and localization; Attack detection; Attack localization; Message passing; Performance; Message-passing; System state; #cybersecurity
2023,"Guo, Z.; Sun, K.; Park, B.; Simunovic, S.; Kang, W.",A Directed Acyclic Graph Neural Network for AC Optimal Power Flow,https://www.scopus.com/inward/record.uri?eid=2-s2.0-85174738282&doi=10.1109%2fPESGM52003.2023.10252547&partnerID=40&md5=437cc86d59112d9e5d987206a3ff88ef,2023-07,0 citations (Semantic Scholar/DOI) [2025-04-09] 0 citations (Crossref/DOI) [2025-04-07] 0 citations (Crossref/DOI) [2025-04-07] 0 citations (Crossref) [2025-04-02] Journal Abbreviation: IEEE Power Energy Soc. Gen. Meet.,#done; Graph neural networks; Neural-networks; Electric load flow; Flow graphs; Acoustic generators; Optimal power flows; Optimization; Iterative methods; AC optimal power flow; Power flow algorithm; Acyclic graphs; compositional function; Compositional function; Computational complexity; DAG; Direct acyclic graphs; directed acyclic graph; Directed acyclic graph; neural network; #optimization-control
2023,"Gu, S.; Qiao, J.; Shi, W.; Yang, F.; Zhou, X.; Zhao, Z.",Multi-task transient stability assessment of power system based on graph neural network with interpretable attribution analysis,https://linkinghub.elsevier.com/retrieve/pii/S2352484723009083,2023-10,8 citations (Semantic Scholar/DOI) [2025-04-09] 9 citations (Crossref/DOI) [2025-04-07] 9 citations (Crossref) [2025-04-02] Publisher: Elsevier Ltd,#done; Graph neural networks; Power; Graph neural network; Deep learning; Topology; notion; Decision making; Electric power system stability; Transient stability assessment; Transient analysis; Wide area networks; Multi tasks; Generalisation; Angle stability; Additives; Shapley additive explanation; Deep learning interpretable method; Hidden layers; Shapley; #faults-reliability
2024,"Giamarelos, N.; Zois, E.N.",Boosting short term electric load forecasting of high & medium voltage substations with visibility graphs and graph neural networks,https://www.scopus.com/inward/record.uri?eid=2-s2.0-85185391798&doi=10.1016%2fj.segan.2024.101304&partnerID=40&md5=6b12a966bf4c6de28ba7131b1224662c,2024-06,0 citations (Semantic Scholar/DOI) [2025-11-26] 7 citations (Semantic Scholar/DOI) [2025-04-09] 7 citations (Crossref/DOI) [2025-04-07] 7 citations (Crossref) [2025-04-02] Publisher: Elsevier Ltd,#done; Power grids; Graph neural networks; Graph Neural Networks; Forecasting; Electric power plant loads; Short term load forecasting; notion; Smart power grids; Electric substations; Machine learning; Renewable energy; Short-term electric load forecasting; Renewable energy source; Energy policy; Energy crisis; High voltage substations; Medium voltage substations; Short-term Load Forecasting; Standards and requirements; Visibility; Visibility Graph; Visibility graphs; #forecasting
2023,"Gautam, P.; Sreejith, A.; Natarajan, B.",A Transductive Graph Neural Network learning for Grid Resilience Analysis,https://www.scopus.com/inward/record.uri?eid=2-s2.0-85180755379&doi=10.1109%2fSmartGridComm57358.2023.10333912&partnerID=40&md5=982df0e481593c79a0367e7920ba5e5f,2023-10,"0 citations (Semantic Scholar/DOI) [2025-04-09] 0 citations (Crossref/DOI) [2025-04-07] 0 citations (Crossref) [2025-04-02] Journal Abbreviation: IEEE Int. Conf. Commun., Control, Comput. Technol. Smart Grids, SmartGridComm - Proc.",#done; Power grids; graph neural networks; Graph neural networks; Graph theory; Graphic methods; Learning systems; Outages; Cascading outages; Critical node; cascading outage; Electricity supply; grid resilience; Grid resilience; Neural network learning; resilience metrics; Resilience metrics; Simulation-based method; transductive learning; Transductive learning; #faults-reliability
2023,"Gao, Z.; Li, Z.; Xu, L.; Yu, J.",Dynamic adaptive spatio-temporal graph neural network for multi-node offshore wind speed forecasting,https://www.scopus.com/inward/record.uri?eid=2-s2.0-85152935535&doi=10.1016%2fj.asoc.2023.110294&partnerID=40&md5=437dc638ea27ab6e64856cd01def05ce,2023-07,17 citations (Semantic Scholar/DOI) [2025-04-09] 13 citations (Crossref/DOI) [2025-04-07] 13 citations (Crossref) [2025-04-02] Publisher: Elsevier Ltd,#done; Graph neural networks; Deep learning; Forecasting; Convolution; notion; Spatio-temporal graphs; Wind speed; Dynamic-adaptive; Spatial dependencies; Wind speed forecasting; Dynamic graph; Dynamic graph convolution; Dynamic spatial; Dynamic spatial dependencies; Dynamic spatial dependency; Offshore oil well production; #forecasting
2023,"Ganjouri, M.; Moattari, M.; Forouzantabar, A.; Azadi, M.",Spatial-temporal learning structure for short-term load forecasting,https://www.scopus.com/inward/record.uri?eid=2-s2.0-85143894086&doi=10.1049%2fgtd2.12684&partnerID=40&md5=17423066d04adbbce9774c9afd3a8466,2023,4 citations (Semantic Scholar/DOI) [2025-11-26] 1 citations (Semantic Scholar/DOI) [2025-04-09] 0 citations (Crossref/DOI) [2025-04-07] 0 citations (Crossref) [2025-04-02] Publisher: John Wiley and Sons Inc,#done; Convolutional neural networks; Graph neural networks; Convolutional neural network; Electric power distribution; Electric power plant loads; Graphic methods; Short term load forecasting; short-term load forecasting; Learning systems; notion; Deep neural networks; Electric power transmission networks; Weather forecasting; Electric load shedding; Recurrent neural networks; Meteorology; Performance; Graph networks; Sensitivity analysis; Encoder-decoder; Network coding; bidirectional gated recurrent unit; Bidirectional gated recurrent unit; deep graph network; Deep graph network; encoder–decoder; Gabor convolutional neural network; Gabor filters; Learning structure; meteorological data; Meteorological data; #forecasting
