Publication Year,Author,Title,Url,Date,Extra,Manual Tags
2025,"Yuan, C.; Lin, X.; Zhong, W.",Physics-embedded graph learning unlocks integrated energy system modeling,https://www.scopus.com/inward/record.uri?eid=2-s2.0-105014012219&doi=10.1016%2Fj.egyai.2025.100597&partnerID=40&md5=37083e58b29da9863738037a518161a6,2025,Publisher: Elsevier B.V.,#done; Graph neural networks; Graph neural network; Neural-networks; Multi energy; Graph theory; Differential equations; Energy systems; Dynamic models; Integrated energy systems; Integrated energy system; Dynamic characteristic; Dynamics characteristic; Energy flow; Energy transfer; Energy-system models; Flow dynamics; Fluid dynamics; Fluid mechanics; Interpretable AI; #grid-analysis
2025,"Li, Y.; CHEN, G.; Zhou, X.",A Multiscale Time-Aware Graph Mamba Neural Network-Based Method for Multienergy System Consumption Quantiles Forecasting,https://www.scopus.com/inward/record.uri?eid=2-s2.0-105010706990&doi=10.1109%2FJSYST.2025.3579269&partnerID=40&md5=78081a92e015750dd66c8f2faa35b15b,2025,Publisher: Institute of Electrical and Electronics Engineers Inc.,#done; Graph neural networks; Graph neural network; Neural-networks; Forecasting; Time series; Graph theory; Electric power utilization; Times series; Uncertainty analysis; integrated energy system; Integrated energy systems; Graph neural networks (GNNs); mamba; Mamba; Multi-energy systems; multienergy system consumption forecasting; Multienergy system consumption forecasting; multiscale time-series; Multiscale time-series; Network-based modeling; #forecasting
2025,"Shi, Z.; Chen, S.; Meng, Y.",MLATD: Photovoltaic power prediction method based on multi-level attention and temporal decoupling,https://www.scopus.com/inward/record.uri?eid=2-s2.0-105019278334&doi=10.1063%2F5.0282105&partnerID=40&md5=67d2aa540b99546b14b9e9fd40f264b7,2025,Publisher: American Institute of Physics,#done; Power; Forecasting; Power predictions; Multilevels; Prediction methods; Backpropagation; Photovoltaic power; Photovoltaics; Power forecasting; Mean square error; Photovoltaic energy; Spatial correlations; Geographical distribution; Photovoltaics generations; Temporal decoupling; #forecasting
2025,"Chen, P.; Li, H.; Zhang, B.; Xue, N.; Yin, H.; Cao, Y.",Interpretable localization of false data injection attacks in smart grids: a multi-head graph convolutional attention network approach,https://www.scopus.com/inward/record.uri?eid=2-s2.0-105018040663&doi=10.1007%2Fs11227-025-07889-1&partnerID=40&md5=e841547d06f4b62389580aa4e4a83c52,2025,Publisher: Springer,#done; Smart grid; Deep learning; Network security; Attention mechanisms; Interpretability; Convolution; False data injection attacks; Smart power grids; Localisation; Cyber security; Decision making; Spatial dependencies; Behavioral research; Attack localization; Interpretable deep learning; Multi-head graph attention mechanism; #cybersecurity
2025,"Feng, H.; Wang, Y.; Wang, Q.",Energy efficiency management and optimization strategies for power grid enterprises based on deep learning,https://www.scopus.com/inward/record.uri?eid=2-s2.0-105020675940&doi=10.1063%2F5.0251054&partnerID=40&md5=b670ab096bdb974d0287e7ee8c9bb03e,2025,Publisher: American Institute of Physics,#done; Power grids; Deep learning; Deep reinforcement learning; Electric power transmission networks; Complex networks; Optimization; Energy; Cost effectiveness; Energy efficiency; Energy management; Optimization strategy; Power grid operators; Resource allocation; Balancing; Dispersed energy source; Efficiency managements; Efficiency optimization; Energy optimization; Grid enterprise; Management strategies; #optimization-control
2025,"Romero, R.M.; Zelinskaya, M.; Makhmudov, S.; Sapaev, S.; Jabbarov, J.U.",Modelling and Optimal Utilisation of the Renewable Energy Systems in Microgrid with Improving Reliability and Energy Efficiency,https://www.scopus.com/inward/record.uri?eid=2-s2.0-105010482228&doi=10.1007%2Fs43069-025-00494-1&partnerID=40&md5=696f3725598b38a7919f0af2509f4542,2025,Publisher: Springer International Publishing,#done; Reliability; Microgrid; Energy efficiency; Energy storage systems; Hybrid strategy; #optimization-control
2025,"Radhika, A.; Kumar, K.V.; Prakash, A.; Thenmozhi, G.",Advanced energy management for a Quasi-Z-Source Inverter-based photovoltaic power plant with battery storage using a hybrid LEO-QCGNN approach,https://www.scopus.com/inward/record.uri?eid=2-s2.0-105012141109&doi=10.1016%2Fj.est.2025.117880&partnerID=40&md5=7d1080e0eec0307ef12ab7cf1280b3b6,2025,Publisher: Elsevier Ltd,#done; Graph neural networks; Renewable energy; Optimisations; Photovoltaic power; Photovoltaics; Electric inverters; Computational efficiency; Mean square error; Energy management systems; Energy; Energy management; Complete graphs; Battery storage; Total harmonic distortions; MATLAB; Data storage equipment; Battery management systems; Electric losses; Lotus effect; Lotus effect optimization; Lotus Effect Optimization; Photovoltaic effects; Power loss reduction; Quantum complete graph neural network; Quantum Complete Graph Neural Network; Quasi-Z-source inverter; Quasi-Z-Source Inverter; Secondary batteries; Total harmonic distortion; Z-source inverter; #optimization-control
2025,"Keçeci, C.; Atat, R.; Ismail, M.; Davis, K.R.; Serpedin, E.",Distributed detection and mitigation of FDIAs in smart grids via federated learning,https://www.scopus.com/inward/record.uri?eid=2-s2.0-105016874441&doi=10.1016%2Fj.ijepes.2025.111126&partnerID=40&md5=c08589956f9fcfeaad4eae01577f6a6f,2025,Publisher: Elsevier Ltd,#done; Power grids; Graph neural networks; Smart grid; Cyber-attacks; False data injection attacks; Learning systems; Smart power grids; Machine learning; Cyber security; Cybersecurity; Electric power transmission networks; Electric power transmission; Power load; Smart grids; Data communication systems; Federated learning; Electric power system measurement; Sensitive data; Data control; Distributed detection; Load profiles; #cybersecurity
2025,"Liu, D.; Zhu, J.; Wen, M.; Liu, J.; Chen, H.",Integrated multi-energy load prediction system with multi-scale temporal channel features fusion,https://www.scopus.com/inward/record.uri?eid=2-s2.0-105003372928&doi=10.1016%2Fj.measurement.2025.117559&partnerID=40&md5=b3b03b0b8d7e2275d81a0b9413366812,2025,Publisher: Elsevier B.V.,#done; Multi energy; Multi-scales; Integrated energy systems; Load predictions; Integrated energy system; Features fusions; Multi-energy load prediction; Residual decomposition; Sparse graph learning; Sparse graphs; Temporal channel feature fusion; Temporal channel features fusion; #forecasting
2025,"Wang, X.; Li, Y.; Luo, X.; Guan, X.",Dual-attention-based spatio-temporal detection model against false data injection attacks in smart grids,https://www.scopus.com/inward/record.uri?eid=2-s2.0-105016462807&doi=10.1016%2Fj.ijepes.2025.111156&partnerID=40&md5=c4520ea9f0b75286f733fd2d05ab6253,2025,Publisher: Elsevier Ltd,#done; Convolutional neural networks; Graph neural networks; Convolutional networks; Network topology; Graph neural network; Smart grid; Network security; Spatio-temporal; Attention mechanisms; Convolution; Spatial temporals; False data injection attacks; Smart power grids; Electric power transmission networks; Smart grids; Computational efficiency; Spatio-temporal data; Temporal convolutional network; Electric power system measurement; Grid data; Grid computing; Dual-attention mechanism; #cybersecurity
2025,"Kaal, T.; Rafiee, A.",Deep Reinforcement Learning-Graph Neural Networks-Dynamic Clustering triplet for Adaptive Multi Energy Microgrid optimization,https://www.scopus.com/inward/record.uri?eid=2-s2.0-105013211101&doi=10.5194%2Fisprs-annals-X-G-2025-427-2025&partnerID=40&md5=b11875bf2aeaaccd51637a6d316595c8,2025,Issue: G-2025 Journal Abbreviation: ISPRS Ann. Photogramm. Remote Sens. Spat. Inf. Sci.,#done; Graph neural networks; Network topology; Graph Neural Network; Deep learning; Deep reinforcement learning; Reinforcement learnings; Renewable energy; Optimisations; Graph structures; Dynamics; Microgrids; Renewable energy source; Electric power transmission; Microgrid; Energy; Energy systems; Energy efficiency; Natural resources; Distributed computer systems; Centralised; Data storage equipment; Deep Reinforcement Learning; Dynamic clustering; Dynamic Clustering; Learning graphs; Renewable Energy Sources; #optimization-control
2025,"Vasudevan, D.; Govindasamy, V.; Mohamedyaseen, M.; Vijayakumar, V.",Enhancing grid stability through CLOA-HMPGNN-based electric vehicle charging system,https://www.scopus.com/inward/record.uri?eid=2-s2.0-105016542510&doi=10.1007%2Fs00202-025-03213-5&partnerID=40&md5=7e8f4ce4a939472154b5a4ac651505a1,2025,Publisher: Springer Science and Business Media Deutschland GmbH,#done; Graph neural networks; Power; Electric power distribution; Electric power transmission networks; Electric power system stability; Charging (batteries); Charging station; Electric vehicle; Electric vehicles; Vehicle-to-grid; Message-passing; Battery; Voltage fluctuations; Charging stations; Optimization algorithms; MATLAB; Electric load distribution; Charging power; Converter; Grid; #optimization-control
2025,"Dong, J.; Han, X.; Zhang, Z.",Short-term Multi Load Forecasting of Integrated Energy System Based on AGCRN,https://www.scopus.com/inward/record.uri?eid=2-s2.0-105013070974&doi=10.1109%2FICETCI64844.2025.11084024&partnerID=40&md5=999afcb1d46038b9b469d8f28927e239,2025,"Journal Abbreviation: IEEE Int. Conf. Electron. Technol., Commun. Inf., ICETCI",#done; Convolutional networks; Load forecasting; Multi energy; Convolution; Gated recurrent unit; Electric power plant loads; Graph theory; Electric load forecasting; Dynamics; Load forecasting model; integrated energy system; Integrated energy systems; gated recurrent unit; Dynamics coupling; adaptive graph convolutional network; Adaptive graph convolutional network; Recurrent networks; short-term multi load forecasting; Short-term multi load forecasting; #forecasting
2025,"Pourmoradi, N.; Ameli, M.T.; Azad, S.",A multitask active transfer learning-based load shedding using a hybrid graph convolutional network–transformer model for transient stability control in power systems with missing data and unseen faults,https://www.scopus.com/inward/record.uri?eid=2-s2.0-105014746027&doi=10.1016%2Fj.rineng.2025.106952&partnerID=40&md5=53f301e05b1e7a76b657862170c053d7,2025,0 citations (Semantic Scholar/DOI) [2025-11-26] Publisher: Elsevier B.V.,#done; Convolutional neural networks; Convolutional networks; Graph convolutional network; Deep learning; Convolution; Learning systems; Multitask learning; Electric power system control; Electric power system stability; Emergency load shedding; Learning algorithms; Load-shedding; Transients; Power control; Missing data; Control system stability; Labeled data; Data communication systems; Transfer learning; Multi-task learning; Transient stability; Electric transformer loads; Active learning; Active transfer learning; Adversarial networks; Conditional tabular generative adversarial network; Small data set; Small dataset; Unseen fault; #faults-reliability
2025,"Wang, K.; Jiang, K.; Su, H.; Li, H.; Zhong, J.; Xiong, J.",Research on topology-aware power flow optimization and load forecasting model of smart grid based on AI,https://www.scopus.com/inward/record.uri?eid=2-s2.0-105015056540&doi=10.1016%2Fj.microc.2025.115046&partnerID=40&md5=d123cf67fa52a8efe53f4acb7c693772,2025,Publisher: Elsevier Inc.,#done; Graph neural network; Smart grid; Load forecasting; Power flow optimization; Topology awareness; #optimization-control
2025,"Li, M.; Yang, M.; Yu, Y.",Short-term regional wind power forecast method based on hierarchical graph neural network and extreme value theory,https://www.scopus.com/inward/record.uri?eid=2-s2.0-105007148796&doi=10.1016%2Fj.enconman.2025.120002&partnerID=40&md5=e47a7c477589e26ff73a1a9561b878cc,2025,Publisher: Elsevier Ltd,#done; Graph neural networks; Graph neural network; Loss functions; Graph algorithms; Long short-term memory; Spatial-temporal correlation; Wind farm; Network theory (graphs); Mean square error; Energy management systems; Wind power forecast; Hierarchical systems; Windmill; Electrification; Hierarchical graphs; Extreme value theory; Forecast method; Forecasting performance; Sub-regions; #forecasting
2025,"Senemmar, S.; Jacob, R.A.; Zhang, J.",Medium Voltage Direct Current Shipboard Power Network Reconfiguration Using Graph-Based Reinforcement Learning,https://www.scopus.com/inward/record.uri?eid=2-s2.0-105012820483&doi=10.1115%2F1.4069035&partnerID=40&md5=b7677c0e59607fac9f8999319d1e170d,2025,Publisher: American Society of Mechanical Engineers (ASME),#done; Deep learning; Reinforcement learnings; Reinforcement learning; Graphic methods; Learning systems; Machine-learning; Resilience; reinforcement learning; Optimization; Markov processes; Direct-current; Electric power systems; artificial intelligence; Distributed computer systems; network reconfiguration; Networks reconfiguration; resilience; Electric ship equipment; Engineering applications; Machine learning for engineering application; machine learning for engineering applications; Medium voltage; medium-voltage direct current; Medium-voltage direct current; shipboard power system; Shipboard power system; #optimization-control
2025,"Murugesan, A.; Durgadevi, K.; Contractor, D.; Rathod, Y.",Machine learning-driven intelligent voltage control in renewable energy grids,https://www.scopus.com/inward/record.uri?eid=2-s2.0-105007517269&doi=10.1016%2Fj.epsr.2025.111869&partnerID=40&md5=96c2127eb7ac03435231b132cdd3ff21,2025,Publisher: Elsevier Ltd,#done; Graph neural networks; Graph neural network; Smart grid; Deep learning; Deep reinforcement learning; Reinforcement learning; Smart power grids; Electric power system control; Real- time; Grid optimization; Smart grid optimization; Multi-agent reinforcement learning; Voltage stability controls; Renewable energy integrations; Wind power integration; Renewable energy integration; and Real-Time grid adaptation; And real-time grid adaptation; Graph neural networks (GNN); Grid adaptation; Multi-Agent reinforcement learning (MARL); Solar fuels; Time grid; Voltage stability control; Voltage stabilization; #optimization-control
2025,"Hou, J.; Yan, Z.; Meng, Y.",A hybrid physics and data-driven framework for ultra-short-term wind power forecasting with spatiotemporal learning,https://www.scopus.com/inward/record.uri?eid=2-s2.0-105006734260&doi=10.1063%2F5.0245781&partnerID=40&md5=a48300789fee2ccd6291bd6c45e2ef52,2025,Publisher: American Institute of Physics,#done; Graph neural networks; Wind power generation; Wind power forecasting; Data driven; Forecasting accuracy; Forecasting models; Short-term wind power forecasting; Integrated energy systems; Stochastics; Hybrid power; Spatio-temporal learning; Hybrid model; #forecasting
2025,"Dong, X.; Du, W.; Fu, Q.; Wang, H.",Domain-adversarial graph neural network for small-signal stability constrained optimal power flow in AC/DC renewable power systems,https://www.scopus.com/inward/record.uri?eid=2-s2.0-105003817176&doi=10.1016%2Fj.epsr.2025.111775&partnerID=40&md5=84df558e19437a1f3ea3621e6f637043,2025,Publisher: Elsevier Ltd,#done; Graph neural networks; Neural-networks; Network theory (graphs); Electric power transmission networks; Optimal power flows; Renewable energy source; Small signal stability; Small-signal stability; Optimal power flow; Lyapunov methods; Solar fuels; Domain-adversarial neural network; Edge-aggregated graph attention network; Edge-aggregated graph attention network (EGAT); Optimal power flow (OPF); Renewable energy sources (RESs); Renewable power systems; Small-signal stability (SSS); #optimization-control
2025,"Kazim, M.; Pirim, H.; Le, C.; Le, T.; Yadav, O.P.",Multilayer GNN for predictive maintenance and clustering in power grids,https://www.scopus.com/inward/record.uri?eid=2-s2.0-105017694994&doi=10.1016%2Fj.isci.2025.113490&partnerID=40&md5=da0709dcc77ac388499d0a49a15143b3,2025,Publisher: Elsevier Inc.,#done; Artificial intelligence; Electrical engineering; Applied sciences; #faults-reliability
2025,"Liu, S.; Xu, D.; Shen, C.; Ye, Y.; Jiang, B.",Intelligent Fault Diagnosis for Battery Packs Using FCE-GCN: Addressing the Challenges of Class Imbalance and Feature Similarity,https://www.scopus.com/inward/record.uri?eid=2-s2.0-105008660397&doi=10.1109%2FTIM.2025.3580790&partnerID=40&md5=e1cb0141e771ae6cb4d60305e5ce6fea,2025,Publisher: Institute of Electrical and Electronics Engineers Inc.,#done; Convolutional networks; Deep learning; Data accuracy; Convolution; Learning systems; System stability; deep learning; fault diagnosis; Data handling; Classification performance; Failure analysis; Fault detection; Faults diagnosis; Classification (of information); Computer aided diagnosis; Electric fault currents; Fault diagnosis method; Signal encoding; Encodings; Battery pack; Battery Pack; Battery systems; Class imbalance; Encoding (symbols); feature encoding; Feature encoding; Lithium-ion batteries; #faults-reliability
2025,"Liu, J.; Huang, Y.; Chen, K.; Liu, G.; Yan, J.; Chen, S.; Xie, Y.; Yu, Y.; Huang, T.",Graph Neural Networks for Fault Diagnosis in Photovoltaic-Integrated Distribution Networks with Weak Features,https://www.scopus.com/inward/record.uri?eid=2-s2.0-105017127195&doi=10.3390%2Fs25185691&partnerID=40&md5=fbb6deb6453f849827fafa23eec286e1,2025,Publisher: Multidisciplinary Digital Publishing Institute (MDPI),#done; Sampling; graph neural networks; Graph neural networks; Power distribution faults; graph neural network; Electric load flow; Electric power distribution; Neural networks; article; human; learning; Fault detection; Faults diagnosis; controlled study; Photovoltaics; Electric fault currents; diagnosis; Training sample; female; reliability; Signal encoding; Encoding (symbols); Photovoltaics generations; male; Distribution network fault diagnose; distribution network fault diagnosis; fault information; Faults information; impedance; low training sample rate; Low training sample rate; Network fault diagnosis; noise; photovoltaic generation; photovoltaics; Sample rate; training; #faults-reliability
2025,"Ma, T.; Yu, J.; Wang, B.; Gao, M.; Yang, Z.; Li, Y.; Fan, M.",A Power Monitor System Cybersecurity Alarm-Tracing Method Based on Knowledge Graph and GCNN,https://www.scopus.com/inward/record.uri?eid=2-s2.0-105013134650&doi=10.3390%2Fapp15158188&partnerID=40&md5=bb6d7187aa868eee72856611154fd054,2025,Publisher: Multidisciplinary Digital Publishing Institute (MDPI),#done; Convolutional neural networks; Convolutional neural network; Network security; Convolution; Cyber security; cybersecurity; Cybersecurity; Electric power transmission networks; Convolution neural network; Knowledge graphs; knowledge graph; Knowledge graph; Sample imbalance; Graph convolution neural network; sample imbalance; Alarm systems; alarm tracing; Alarm tracing; graph convolution neural network; Monitor system; Power monitor; Tracing method; #cybersecurity
2025,"Liu, S.; Tang, Z.; Chai, B.; Zeng, Z.",Robust Distribution System State Estimation with Physics-Constrained Heterogeneous Graph Embedding and Cross-Modal Attention,https://www.scopus.com/inward/record.uri?eid=2-s2.0-105020158842&doi=10.3390%2Fpr13103073&partnerID=40&md5=bbc3b53c2c1b3a7e35e258da2afa5eda,2025,Publisher: Multidisciplinary Digital Publishing Institute (MDPI),#done; Graph neural networks; Network topology; graph neural network; Deep learning; Power flows; Electric load flow; Electric power transmission networks; deep learning; Heterogeneous graph; State estimation; Embeddings; state estimation; Uncertainty analysis; Graph embeddings; Heterogeneous networks; Least squares approximations; Distribution system state estimations; Topology changes; power flow; Spurious signal noise; Cross-modal; Real time distribution; Topology measurements; #grid-analysis
2025,"Lei, T.; Li, J.; Yang, K.; Gong, C.",A novel spatial–temporal graph convolution network based on temporal embedding graph structure learning for multivariate time series prediction,https://www.scopus.com/inward/record.uri?eid=2-s2.0-85211626133&doi=10.1016%2Fj.engappai.2024.109826&partnerID=40&md5=6d09f74a02974632171764be49a32054,2025,Publisher: Elsevier Ltd,#done; Convolutional neural networks; Graph neural networks; Multivariate time series; Prediction models; Graph structures; Time-series data; Graph embeddings; Graph structure learning; Structure-learning; Temporal and spatial; Time series prediction; Laplacian sharpening; Laplacians; #forecasting
2025,"Gulraiz, A.; Zaidi, S.S.H.; Gulraiz, H.; Khan, B.M.; Ali, M.; Khan, B.",Leveraging dense layer hybrid graph neural networks for managing overvoltage in PV-dominated distribution systems,https://www.scopus.com/inward/record.uri?eid=2-s2.0-105010848028&doi=10.1016%2Fj.rineng.2025.106169&partnerID=40&md5=d2bfa35691b339a48543a2dd786ba7e4,2025,Publisher: Elsevier B.V.,#done; Graph neural networks; Power distribution networks; Graph neural network; Neural-networks; Deep learning; Distribution networks; Electric power distribution; Graph theory; Graphic methods; Learning systems; Machine-learning; Deep neural networks; Machine learning; Renewable energies; Renewable energy; Graph structures; Learning algorithms; Errors; Photovoltaics; Electric inverters; Mean square error; Performance; Voltage distribution measurement; Voltage prediction; Grid integration; Graph neural networks (GNN); Neural network performance; Overvoltage mitigation; Overvoltage mitigations; Smart inverters; #forecasting
2025,"Anitha, C.; Naveena Kumar, R.R.; Deokar, S.U.; Shah, H.; Nandankar, P.V.; Natrayan, L.",Optimal Scheduling of Microgrid with Electric Vehicle Integration in Smart Grid using Progressive Graph Convolutional Network,https://www.scopus.com/inward/record.uri?eid=2-s2.0-105007999028&doi=10.1109%2FICTMIM65579.2025.10988142&partnerID=40&md5=4107e1d92be22cdf810059f3f58da263,2025,"Journal Abbreviation: Proc. Int. Conf. Trends Mater. Sci. Inventive Mater., ICTMIM",#done; Convolutional networks; Smart grid; Convolution; Electric power distribution; Smart Grid; Electric power transmission networks; Complex networks; Renewable energy; Charging (batteries); Electric vehicle charging; Electric vehicles; Vehicle-to-grid; Microgrids; Photovoltaics; Genetic algorithms; Microgrid; Cost effectiveness; Optimal scheduling; Photovoltaic; Ant colony optimization; Cost of energies; Electric Vehicle Integration; Electric vehicle integrations; Levelized costs; MATLAB; Particle swarm optimization (PSO); Progressive graph convolutional network; Progressive Graph Convolutional Network; Swarm intelligence; #optimization-control
2025,"Wang, H.; Zheng, X.; Lai, W.",Short-term power prediction of regional distributed photovoltaic power plants based on spatiotemporal information fusion,https://www.scopus.com/inward/record.uri?eid=2-s2.0-105012098226&doi=10.1063%2F5.0266953&partnerID=40&md5=ed7300493f56cc63268d1df00d2a9d40,2025,Publisher: American Institute of Physics,#done; Convolutional neural networks; Convolutional networks; Neural network model; Forecasting; Convolution; Smart power grids; Power predictions; Spatio-temporal graphs; Photovoltaics; Prediction accuracy; Genetic algorithms; Spatiotemporal information; Geographics; Information fusion; Photovoltaic power plant; Power station; Collaborative forecasting; Fusion reactions; #forecasting
2025,"Jiang, K.; Ye, C.; Ao, Y.; Xiao, M.; Li, J.; Xiong, L.; Xu, X.",Non-solution power flow diagnosis method for AC/DC hybrid power grid based on topology-aware graph neural network,https://www.scopus.com/inward/record.uri?eid=2-s2.0-105018067523&doi=10.1063%2F5.0300246&partnerID=40&md5=cac67bfda9a185ecdbd133d76e9389eb,2025,Publisher: American Institute of Physics,#done; Power grids; Graph neural networks; Network topology; Power flows; Electric load flow; Benchmarking; Topological changes; Grid-based; Data acquisition; Nonlinear equations; Topology aware; Hybrid power; Power systems computer aided design; DC grid; Computer aided design; Diagnosis methods; Flow diagnosis; Rectifying circuits; #grid-analysis; #
2025,"Yang, K.; Xue, F.; Huang, T.; Lu, S.; Jiang, L.; Xu, X.",Lightweight model for power grid cascading failures risk evaluation based on graph physics-informed attention network,https://www.scopus.com/inward/record.uri?eid=2-s2.0-105007744407&doi=10.1016%2Fj.eswa.2025.128468&partnerID=40&md5=08ed3171dc5a252ce09c1f93155faee4,2025,Publisher: Elsevier Ltd,#done; Power grids; Graph algorithms; Power flows; Cascading failures; Network theory (graphs); Smart power grids; Electric power transmission networks; Risk analysis; Power transmission lines; Risk assessment; Power grid; Graph classification; Complex network; Grid reliability; Physic-informed; Failure risk evaluation; Flow-based models; On-line applications; Physical dynamics; Physics-informed; #faults-reliability
2025,"Han, L.; Wang, J.",A regional electricity price prediction method based on Transformer and Graph Neural Networks,https://www.scopus.com/inward/record.uri?eid=2-s2.0-105005582257&doi=10.1016%2Fj.aej.2025.04.050&partnerID=40&md5=930795fa1aec27b73e5d501410bd80ab,2025,Publisher: Elsevier B.V.,#done; Graph neural networks; Graph neural network; Deep learning; Transformer; Deep neural networks; Electric power system interconnection; Prediction methods; Spatial dependencies; Electric industry; Electricity prices; Crude oil price; Electricity market; Heterogeneous data integration; Heterogeneous data integrations; Optimizing energy; Price prediction; Regional electricity price prediction; #forecasting
